Cluster,Size,Density,Internal weight,External weight,Quality,P-value,Members
1,126,0.1937,1526,6900,0.1758,1.00000,"AS3MT CDHR1 CHAT COL13A1 HABP2 LIPF LRIT1 MINPP1 NUTM2A OPN4 PALD1 PAPSS2 PAX2 PPP3CB SRGN SYNPO2L TET1 TLL2 TECTB PPP1R3C FBXL15 GLUD1 BLOC1S2 CYP17A1 FAM45A GOT1 SNCG NKX2-3 ACTA2 LIPM ENTPD7 CCDC147 CCDC172 ELOVL3 STAMBPL1 KCNK18 ABCC2 ANKRD22 AVPI1 BTRC CNNM1 CNNM2 CYP26A1 DNMBP DNTT ERLIN1 GOLGA7B HIF1AN HPS6 HSPA12A IDE IFIT2 ITPRIP MMRN2 MORN4 NT5C2 PANK1 PCGF6 PDZD7 PI4K2A PITX3 PKD2L1 POLL PSD PYROXD2 RNLS SEMA4G SFXN2 SH3PXD2A VTI1A ZFYVE27 CC2D2B KCNIP2 SFRP5 CASP7 DPCD LIPJ BLNK ABLIM1 ADIRF ADRA2A ADRB1 HOGA1 LCOR SFXN3 SAMD8 IFIT1 LOXL4 OPALIN CUTC FAS SLK IFIT1B FFAR4 FGF8 AFAP1L2 TSPAN14 ANXA7 AIFM2 C10orf95 C10orf99 CCNJ DYDC1 MAT1A PNLIPRP1 SLC16A12 CUEDC2 CYP26C1 LIPK XPNPEP1 DYDC2 SORCS1 SORBS1 CALHM3 CYP2C9 ARL3 LIPA NEURL1 SORCS3 VWA2 ARHGAP19 SLC35G1 CFAP43 RBP4 LIPN TLX1"
2,7,0.5937,12.47,85.26,0.1116,0.999299,"C7orf26 BRAT1 INTS10 ASUN SNRPB2 VWA9 WDR73"
3,167,0.1925,2669,9136,0.2199,1.00000,"CCDC9 CGB2 DHDH PGLYRP1 SYNGR4 ZNF225 FUT1 ITPKC PSG2 GRIN2D C19orf47 TMEM160 GIPR ZNF285 APOC1 PPP1R37 ZNF229 CNTD2 ATP1A3 PNMAL1 FLT3LG PVRL2 TTC9B CEACAM4 CPT1C ZNF224 CA11 SLC8A2 B9D2 CCDC97 TMEM145 CLPTM1 CNFN RABAC1 DKKL1 ERCC1 APOC4 RAB4B SRRM5 NPAS1 CYP2B6 FAM83E ADM5 LYPD5 LGALS13 PPP5C GSK3A ZFAND5 CATSPERG B3GNT8 PSG6 FOSB VASP C19orf83 CLC QPCTL SHKBP1 APOC2 BCKDHA DMPK PINLYP MEIS3 IGSF23 SPTBN4 TMEM143 LILRA1 PLEKHG2 C19orf73 ELSPBP1 CCDC61 NTN5 IGFL1 ZNF45 CYP2S1 PRX GRIK5 PVR CEACAM3 PLA2G4C CYTH2 KPTN EML2 IFNL2 CEACAM7 TPRX1 PSG1 FGF21 CYP2A6 CGB5 GNG8 CYP2A13 RSPH6A KLC3 RTN2 IGFL2 FOXA3 PNMAL2 ETHE1 CARD8 CCDC114 CALM3 NANOS2 FKRP MYPOP MIA ARHGEF1 C19orf54 LGALS14 SIX5 SPACA4 UPK1A ZNF155 ZNF230 ZNF284 HIPK4 FBXO46 LYPD4 ZNF180 C5AR1 CEACAM21 NTF4 SULT2A1 SULT2B1 APOE MARK4 PRR19 OPA3 TGFB1 CBLC ZNF296 C5AR2 CADM4 DMRTC2 PSG5 CEACAM5 PSG3 SLC1A5 KCNN4 PHLDB3 ZNF233 ZNF780B CEACAM19 SPHK2 TRAPPC6A MAG LIPE CEACAM6 TMEM91 CEACAM16 PTGIR ZNF227 GPR4 TEX101 CRX ZNF222 ZNF226 ZNF235 CXCL17 PSG8 PRKD2 PSG11 PSG9 DMWD DACT3 PSG4 CIC CYP2A7"
4,201,0.1917,3854,7694,0.3225,0.715094,"NPFF ANO6 LMBR1L FAIM2 HOXC11 SCN8A LACRT ARF3 LRRK2 TARBP2 DDIT3 INHBC STAT6 GLI1 AGAP2 KRT5 DNAJC22 SCAF11 INHBE METTL7B PPP1R1A SLC38A4 ANKRD33 CCDC184 KRT77 SOAT2 ASIC1 MIP OR6C4 SLC39A5 C12orf40 ATF7 HOXC6 GTSF1 KCNC2 TMEM194A SLC26A10 TMBIM6 ACVRL1 CNTN1 ENDOU MAP3K12 NELL2 PUS7L SENP1 VDR BIN2 DHH KRT83 BCDIN3D WNT1 CYP27B1 C1QL4 CD63 CSAD TMPRSS12 NXPH4 PHC1 CBX5 STAT2 C12orf10 COQ10A NDUFA4L2 ZBTB39 ATF1 DIP2B NR4A1 PRPF40B SLC4A8 GLS2 KRT75 AMHR2 PFKM NAB2 SMAGP KCNH3 MYO1A TMEM106C R3HDM2 LETMD1 HDAC7 ZNF641 MYL6B STAC3 GRASP DCD TMEM5 ESYT1 KRT86 SDR9C7 HOXC8 NEUROD4 CALCOCO1 XRCC6BP1 CSRNP2 APOF ANP32D ZNF385A FMNL3 GPD1 GXYLT1 HOXC12 POU6F1 ARHGAP9 AQP2 AQP5 CCDC65 DGKA DNAJC14 H1FNT IKZF4 KRT6B KRT78 KRT79 KRT82 METTL7A OR6C3 OR6C75 PMEL MSRB3 ATXN7L3B DTX3 KRT84 C12orf54 GALNT6 KRT3 OR10A7 ADAMTS20 ATP5G2 CELA1 KRT85 LALBA NCKAP5L PRKAG1 PRPH RNF41 TENC1 TMEM117 KIF5A METTL21B CERS5 ADCY6 ARHGEF25 ASB8 OR8S1 SPRYD3 AQP6 OR2AP1 NFE2 B4GALNT1 IGFBP6 OR10AD1 SPRYD4 SP7 OR6C2 HOXC4 SMUG1 HIGD1C PCED1B AVIL CTDSP2 DAZAP2 FAM186A HOXC10 HOXC5 ITGA7 KRT4 KRT74 MARCH9 ORMDL2 OS9 PIP4K2C RDH5 SHMT2 SUOX TBC1D30 TSFM TSPAN31 FKBP11 RHEBL1 KRT1 PDE1B GPR182 PAN2 TUBA1A CACNB3 OR10P1 YAF2 DDN ITGA5 LIMA1 TESPA1 ITGB7 PRICKLE1 COL2A1 LARP4 SPATS2 NCKAP1L MUCL1 IL23A KRT80"
5,120,0.1880,1342,5973,0.1777,1.00000,"ZMYND12 FAAH KNCN TXNDC12 TESK2 MPL TXLNA PODN CITED4 B4GALT2 HECTD3 C1orf123 DMRTA2 CCDC30 HPDL DNALI1 ZSWIM5 C1orf87 EXO5 PTCH2 ERMAP MFSD2A CC2D1B EDN2 SGIP1 DMRTB1 RAD54L ZFP69 HIVEP3 CYB5RL HEYL CTH PTPRF LAPTM5 HOOK1 AKIRIN1 C1orf141 TSPAN1 RIMS3 ZSCAN20 FNDC5 KIAA0319L COL9A2 CYP4X1 PPT1 SMAP2 WDR65 C1orf228 CPT2 GJB3 NT5C1A FOXE3 CCDC17 MYCBP CSMD2 GJB5 GUCA2B ATG4C OSCP1 RSPO1 SZT2 FAM167B SAMD13 LEPRE1 LURAP1 C1orf50 INPP5B MROH7 C1orf177 OXCT2 AGO4 SLC6A9 ST3GAL3 PDZK1IP1 ZFP69B BMP8A SLC1A7 HYI PABPC4 TMEM125 FABP3 PCSK9 EPS15 KCNQ4 AZIN2 RAB3B BEST4 HPCA HPCAL4 FAM183A ZYG11B SLC5A9 TMEM61 RIMKLA COL8A2 MUTYH SLFNL1 TCTEX1D4 TEKT2 ZNF684 BSND ZBTB8B AKR1A1 GJA9 ZNF691 BMP8B TAL1 RPE65 DIRAS3 POMGNT1 SCMH1 GPX7 PLA2G12A TMEM53 CCDC24 KLF17 TIE1 CDCP2 LDLRAD1 CLDN19"
6,10,0.5278,23.75,188.1,0.1024,0.999780,"EXOC7 RABIF EXOC5 STXBP3 RAB10 EXOC2 STX4 SNAP23 EXOC8 EXOC1"
7,21,0.4681,98.30,395.9,0.1833,0.999987,"ARHGEF7 PARVA ITGB1 NCKAP1 RAC1 RSU1 ILK DOCK5 VCL PXN CRKL BCAR1 ELMO2 LIMS1 ITGB5 RAPH1 RAPGEF1 FERMT2 ITGAV PTK2 TLN1"
8,71,0.1635,406.3,3336,0.1046,1.00000,"TLX2 CDC42EP3 OTOF CRIM1 XDH ERLEC1 CCDC88A VIT RAD51AP2 C2orf71 THUMPD2 APOB C2orf70 FNDC4 CAPN13 DHX57 GALM GAREML GTF2A1L ZNF512 ABHD1 AGBL5 C2orf16 CLHC1 DQX1 HADHB ITGB1BP1 ITSN2 KHK LAPTM4A MAPRE3 FOSL2 KRTCAP3 VSNL1 TCF23 HNRNPLL IFT172 DTNB MSH2 PFN4 ATRAID TRIM54 CGREF1 PLB1 PUM2 TTC32 TP53I3 KIF3C SLC30A3 CIB4 ARHGEF33 TRMT61B NCOA1 LBH SPDYA DPYSL5 ALK DNMT3A RBKS CCDC121 NLRC4 FAM179A GCKR EMILIN1 HS1BP3 SLC4A1AP TMEM214 DRC1 STRN RHOB GPR113"
9,115,0.1957,1283,5521,0.1823,1.00000,"FAHD2A VWA3B ZC3H6 RABL2A ACOXL MGAT5 AMER3 C2orf49 FAP FAM178B INPP4A TTL IL37 TXNDC9 RFX8 CHST10 ADRA2B ANKRD36 CFC1 DAPL1 FBLN7 GYPC IL1RL1 LMAN2L TMEM185B TMEM182 PTPN18 MFSD9 SEMA4C SLC9A2 TBC1D8 MALL PTPN4 UPP2 AFF3 ANKRD23 MITD1 SLC35F5 SLC38A11 PSD4 MZT2A KCNIP3 INSIG2 TNFAIP6 PROC LYG2 NXPH2 SULT1C4 GPR45 IL1RL2 KIAA1211L TEKT4 CNGA3 ST6GAL2 TMEM177 ANKRD39 ASTL BCL2L11 C2orf15 CCDC138 CFC1B CHCHD5 CNNM4 CYTIP DPP10 EN1 FAM168B GCA GLI2 IL18RAP IL1F10 IL1RN IL36A IL36B ITPRIPL1 MARCO MGAT4A NCK2 NMS NPHP1 PLEKHB2 SCTR SULT1C2 TANK TMEM163 TMEM87B TSGA10 GPR148 PROM2 CCDC74B ACTR1B BIN1 LYG1 PDCL3 TUBA3D IL1B CYP27C1 SOWAHC POU3F3 SULT1C3 SLC9A4 GPAT2 IL36G RNF149 MYO7B CXCR4 ZAP70 TRIM43 DLX2 DBI MAP3K19 CCNT2 IL1A IL1R2 POTEI"
10,161,0.2457,3164,7011,0.3015,0.999333,"LRRC36 HP DOK4 KIFC3 RANBP10 LONP2 RRAD KIAA0895L BCO1 PRSS54 CSNK2A2 HSD11B2 VAT1L CES5A CLEC18A DPEP2 FBXL8 TSNAXIP1 WWP2 CMTM4 NRN1L LPCAT2 CA7 MT3 MT4 E2F4 SNTB2 RSPRY1 MLKL B3GNT9 ABCC11 ABCC12 AGRP C16orf78 C16orf87 C16orf97 CBLN1 CCDC135 CCL22 CDH16 CETP CKLF CPNE2 CX3CL1 GLG1 GPR114 IRX6 MMP2 MT1B MT1F NLRC5 PDP2 PHKB PLLP RBL2 SALL1 SHCBP1 SLC12A3 SLC38A7 TEPP TK2 BBS2 C16orf70 CAPNS2 CDH13 CES1 CES3 CES4A CLEC18C CMTM1 FAM192A GPR56 GPR97 ITFG1 LDHD MT1A MT1G MTSS1L NOD2 PLEKHG4 PSMB10 TMED6 USB1 ZDHHC1 ZNF19 ZNF319 CALB2 CMTM2 CDH3 CTRB1 MT2A CTRB2 CCDC113 CHST6 EXOC3L1 DYNC1LI2 KCTD19 IL34 CCDC102A ESRP2 SETD6 HYDIN AMFR RLTPR ZNF23 ACD CCL17 CES2 PARD6A ZFP1 NOL3 FHOD1 SLC12A4 CHST4 PHLPP2 DUS2 NFATC3 LCAT MT1X HSF4 ARL2BP MMP15 ST3GAL2 C16orf46 CHD9 CHST5 CDH5 WWOX SLC9A5 CNGB1 SLC6A2 FUK BEAN1 CLEC18B DPEP3 ENKD1 LRRC29 PDPR SLC7A6 TERF2IP ZNF821 GFOD2 TRADD TOX3 PLA2G15 ZFP90 PDF TMEM208 C16orf86 CDH11 CMTM3 NDRG4 SMPD3 TPPP3 MT1H ZNF423 AKTIP COQ9 HAS3 EDC4 NFAT5"
11,150,0.2000,2235,7049,0.2332,1.00000,"A1CF ALOX5 ANTXRL AP3M1 ARID5B ASAH2 C10orf128 C10orf25 C10orf53 CAMK2G CDH23 CDHR1 CHAT COL13A1 CSGALNACT2 CTNNA3 DKK1 DNAJB12 DNAJC12 DUPD1 DUSP13 ERCC6 FAM13C FAM21A FAM21C FAM35A GPRIN2 H2AFY2 LRRC18 LRRC20 MCU MINPP1 MSMB MTRNR2L5 NDST2 NPY4R NUDT13 NUTM2A OGDHL OIT3 OPN4 PALD1 PAPSS2 PBLD PHYHIPL PLA2G12B PLAU PPP3CB PRKG1 PSAP RET RTKN2 SFTPA2 SGMS1 SLC16A9 SLC18A3 SLC25A16 SRGN SYNPO2L SYT15 TBATA TET1 TMEM72 TTC18 VSTM4 ZFAND4 ZNF239 ZNF33B ZNF365 ZNF503 NCOA4 ZNF32 C10orf11 EIF4EBP2 LDB3 NEUROG3 NPFFR1 CXCL12 CYP17A1 ATOH7 USP54 FAM149B1 MYOZ1 ANAPC16 C10orf54 ZNF22 DDX50 MMRN2 RNLS SEMA4G HKDC1 PTPN20B FAM25A ADIRF AGAP6 FXYD4 PLAC9 FUT11 LRRTM3 SAMD8 ANXA11 UBE2D1 COMTD1 ASCC1 SLC29A3 ANK3 ZNF485 ADK TSPAN14 SFTPA1 ANXA7 CHST3 ZSWIM8 AIFM2 DYDC1 MAT1A MBL2 PCBD1 RBP3 UNC5B MARCH8 KAT6B ADAMTS14 C10orf55 TMEM26 TSPAN15 ANXA8 ZNF488 ANXA8L1 PGBD3 NUTM2B RASSF4 GDF2 DRGX RASGEF1A SFTPD AGAP5 OR13A1 ADO FRMPD2 PCDH15 WDFY4 C10orf10 AGAP9 FAM170B NODAL HERC4 MICU1 TACR2 BICC1"
12,5,0.9581,9.581,77.59,0.09860,0.996692,"UBA6 PPP1R15B BIRC6 KCMF1 UBR4"
13,165,0.1842,2492,7591,0.2393,1.00000,"STRC SQRDL PPIB RTF1 SERINC4 C15orf62 MAPKBP1 C15orf57 GOLGA8B PGBD4 PAK6 IGDCC3 TEX9 FAM227B SLC24A5 SNURF ZSCAN29 CASC4 DLL4 MYEF2 MYO5C C15orf52 FAN1 RMDN3 ABCB10 AP4E1 ATP10A EID1 EXD1 FSIP1 GABRB3 GJD2 GOLGA6L1 GREM1 HERC2 LPCAT4 MKRN3 RASGRP1 SLC12A1 TYRO3 NPAP1 PPIP5K1 STARD9 B2M ELL3 TMEM62 UBR1 DAPK2 BNIP2 NOX5 KIAA0101 SPTBN5 TLN2 MYZAP BLOC1S6 DEXI WDR76 CHAC1 TTBK2 LTK TMOD3 SLC27A2 SERF2 TGM5 PLCB2 DUOXA1 GCHFR MAP1A ZNF280D NIPA2 DPP8 CCPG1 DUOX2 SPINT1 CSNK1G1 APH1B C15orf54 CGNL1 FOXB1 PLA2G4B CHRNA7 CAPN3 TRPM1 CYP19A1 DUOX1 NUSAP1 FBN1 RORA GANC PPP1R14D RPUSD2 TRIM69 FRMD5 C15orf48 PLA2G4D APBA2 CHRM5 SORD CTXN2 CCNDBP1 TMCO5A ADAL ALDH1A2 ANKDD1A AQP9 ARHGAP11A ARHGAP11B AVEN BAHD1 BMF C15orf43 CA12 CKMT1B DUOXA2 EPB42 FMN1 GLDN GNB5 GPR176 JMJD7 MTMR10 PLA2G4F RYR3 SEMA6D SHC4 SLC12A6 TMEM87A USP50 CATSPER2 HDC SNX22 GOLGA6L6 KBTBD13 PYGO1 SLC28A2 PLA2G4E TGM7 THBS1 DMXL2 FBXL22 BCL2L10 DISP2 USP3 C15orf53 TPM1 MAPK6 NDN FGF7 ITPKA MYO5A PARP16 PIGH UNC13C OTUD7A OCA2 PRTG NIPA1 TRIP4 GOLGA8M GCNT3 CHRFAM7A SPG11 GOLGA8H GABRA5 RNF145"
14,12,0.2041,13.47,177.9,0.06253,0.999986,"PSMB6 IREB2 ACO2 SOD2 GLRX3 THAP11 MAX ZNF143 FBXO7 THAP1 PSMB5 MYC"
15,84,0.2001,697.6,4142,0.1393,1.00000,"TBC1D19 APBB2 CHRNA9 MAN2B2 CRIPAK TXK SEL1L3 SORCS2 S100P ZFYVE28 BEND4 ATP10D MFSD10 GABRA4 N4BP2 NOP14 SH3BP2 GRXCR1 SMIM14 TLR1 SLBP FAM114A1 SLAIN2 HMX1 SLC34A2 POLN UVSSA LIMCH1 OCIAD1 MXD4 PGM2 SH3TC1 TBC1D1 ADD1 TEC MRFAP1 YIPF7 FAM184B EVC2 KCNIP4 CCKAR CNGA1 COMMD8 CWH43 KLHL5 MRFAP1L1 PPP2R2C SHISA3 TLR6 TMEM156 WDR19 GRK4 NWD2 SLC10A4 GRPEL1 CLRN2 ZCCHC4 ZAR1 PCDH7 DCAF4L1 GABRB1 CD38 OCIAD2 NIPAL1 SLIT2 FGFBP2 LGI2 LETM1 PACRGL TLR10 CORIN GABRG1 UGDH RELL1 DHX15 HAUS3 MED28 NCAPG COX7B2 FRYL RFC1 KCTD8 ATP8A1 STX18"
16,228,0.1950,5046,8938,0.3494,0.0352151,"TMEM211 HPS1 CECR1 APOBEC3C APOBEC3G APOL1 BAIAP2L2 CBX6 CSDC2 CSNK1E CYTH4 DESI1 DUSP18 ENTHD1 FOXRED2 GSTT2 IL2RB KCTD17 MB MCHR1 MGAT3 MKL1 PICK1 SLC16A8 SLC25A17 SYNGR1 TEF TNRC6B TSSK2 C22orf39 CECR5 RTN4R AP1B1 CACNA1I CBY1 MIF GNAZ SYN3 MICALL1 MPPE1 BPIFC RNF185 ISX DGCR6L GATSL3 KDELR3 CABP7 CRYBB2 YPEL1 DRG1 LARGE ARVCF LIF RFPL3 SLC2A11 JOSD1 RTDR1 NPTXR CLTCL1 CLDN5 EIF3L GSTT2B HIC2 KLHL22 SLC7A4 GAL3ST1 GUCD1 HORMAD2 LRRC75B TMEM184B VPREB1 ZNF74 MTFP1 NCF4 DGCR6 INPP5J TRMT2A BID C22orf29 RASL10A APOL6 HMGXB4 SFI1 SEC14L3 APOL2 IFT27 APOL5 SH3BP1 SMTN PPM1F CRYBB3 CHADL LGALS1 DDTL ELFN2 CECR6 PIK3IP1 TXNRD2 MAFF SEPT5 TBC1D10A USP18 ZNRF3 TMPRSS6 SSTR3 APOBEC3F RAB36 SUSD2 SELM SLC5A1 SUN2 MYO18B SIRPA EMID1 C22orf31 NIPSNAP1 TAB1 IGLL1 DGCR8 CCDC117 SDF2L1 PATZ1 MORC2 RFPL2 SEC14L6 C1QTNF6 SERPIND1 RHBDD3 ADRBK2 HPS4 SGSM1 UPB1 CCT8L2 KREMEN1 BCR ZNF280B ANKRD54 SEZ6L SNAP29 DERL3 SEC14L4 PRR14L YWHAH LZTR1 GCAT GRAP2 DNAL4 KCNJ4 L3MBTL2 ADORA2A APOBEC3A APOL3 ASCC2 C22orf15 C22orf23 CCDC116 CCDC157 CHCHD10 CRYBB1 CSF2RB DMC1 FAM83F GAB4 HMOX1 KIAA1671 MMP11 OSBP2 OSM PIWIL3 PRAME PRODH RASD2 RGL4 RIMBP3B SEC14L2 SLC25A18 THAP7 TPST2 TST TTC28 TUBA8 XKR3 ZDHHC8 SCARF2 TOP3B DGCR2 AIFM3 BCL2L13 DRICH1 GALR3 LIMK2 RIMBP3 VPREB3 YDJC C22orf24 TEX33 DNAJB7 GGT1 MICAL3 COMT E2F6 GGA1 GGTLC2 GP1BB GSC2 LRP5L P2RX6 PLA2G3 PVALB RAC2 TANGO2 TBX1 TCN2 RFPL1 LGALS2 CRYBA4 SLC5A4 PLA2G6 MFNG TRIOBP EIF4ENIF1 CARD10 APOBEC3D SERHL2 RNF215 CACNG2 IL17RA IGLL5"
17,187,0.2003,3484,8259,0.2875,0.999883,"RIPK2 TMEM67 LYPLA1 OPRK1 XKR9 NIPAL2 FABP4 CTHRC1 XKR4 AARD ADCY8 ANXA13 ATAD2 BAALC BHLHE22 C8orf76 CA2 CA3 CA8 CDK5 CLVS1 COL14A1 COLEC10 CSMD3 CYP7A1 DCSTAMP DECR1 DEPTOR DERL1 DPY19L4 DPYS ENPP2 FAM110B FAM135B FAM150A FAM83A FAM84B FBXO32 FER1L6 GEM GGH HAS2 HEY1 KCNQ3 KCNS2 KCNV1 KIAA0196 KLHL38 MATN2 MTSS1 NCALD NOV NPBWR1 ODF1 OXR1 RGS22 RNF139 RRM2B RSPO2 SAMD12 SLC30A8 SLC7A13 SNTB1 SNX16 SPAG1 SYBU TMEM55A TMEM65 TNFRSF11B TOX TPD52 TRIB1 TRMT12 WDYHV1 ZFHX4 ZFPM2 ZHX1 ZHX2 ZNF572 TRHR E2F5 ADHFE1 TCEA1 KLF10 SDC2 CPA6 TRPA1 C8orf34 LY96 IMPA1 STAU2 CDH17 CALB1 ASPH ZBTB10 CPQ PCMTD1 TMEM68 CNGB3 SNTG1 C8orf37 C8orf88 CCNE2 PDE7A TCF24 STK3 EFCAB1 OSR2 ST18 RAD54B CEBPD TRAM1 TRIM55 NECAB1 MOS FAM92A1 RAB2A ANGPT1 IMPAD1 LACTB2 CPNE3 ERICH5 TTPA PENK SLC26A7 RUNX1T1 ZFAND1 SOX17 CA1 SDR16C5 PRDM14 DNAJC5B ANKRD46 GDAP1 SLCO5A1 KCNB2 SBSPON RIMS2 ATP6V0D2 DCAF4L2 TMEM70 C8orf22 LYN MCMDC2 NKAIN3 PKIA STMN2 FBXO43 VCPIP1 ARFGEF1 C8orf44 C8orf46 CHCHD7 CHMP4C CRH CSPP1 ESRP1 IL7 MTFR1 NSMAF PAG1 PDP1 PMP2 PXDNL RALYL RP1 SGK3 SULF1 UBE2V2 UBXN2B VPS13B HNF4G AZIN1 SDCBP TMEM74 SNX31 FAM91A1 MMP16 EBAG9 FABP12 GDF6 ZNF704 JPH1 PI15 TP53INP1 UBE2W SPIDR"
18,7,0.6519,13.69,236.7,0.05177,0.999299,"HERC2 GOLGA6L9 CSPG4 ADAMTS7 GOLGA6B GOLGA6L10 UBE2Q2L"
19,118,0.2006,1384,5496,0.1945,1.00000,"HTR2A NHLRC3 PARP4 TNFRSF19 GPR12 DNAJC15 KBTBD7 KCNRG SETDB2 TNFSF11 WASF3 CCNA1 PHF11 ARL11 CAB39L GSX1 CCDC169 TRPC4 ELF1 SPATA13 ATP8A2 FRY SMIM2 PCDH17 GPALPP1 LECT1 RNF17 RXFP2 SOHLH2 N6AMT2 GJB2 SIAH3 URAD LACC1 ZMYM5 KATNAL1 MTUS2 AKAP11 RCBTB1 SGCG ITM2B FGF9 FOXO1 RNF6 KPNA3 COMMD6 POSTN NAA16 HSPH1 N4BP2L2 ZAR1L CPB2 IFT88 RASL11A SPERT NBEA RGCC SERP2 AMER2 ENOX1 PSPC1 FNDC3A TPTE2 TRIM13 KL PRR20A UTP14C MICU2 FLT3 SERTM1 MEDAG N4BP2L1 SLC25A30 DCLK1 ESD PDX1 NEK5 DGKH DLEU7 TEX26 C1QTNF9 TUBA3C LRCH1 SMAD9 SLC25A15 FREM2 UBL3 CKAP2 LHFP SACS LCP1 B3GALTL SLC46A3 DHRS12 RCBTB2 CDX2 ZDHHC20 CDADC1 KIAA0226L ZMYM2 SPG20 PAN3 MPHOSPH8 POLR1D PABPC3 MTRF1 CRYL1 FAM124A LNX2 PDS5B STOML3 TSC22D1 C1QTNF9B ATP12A SHISA2 CSNK1A1L SPRYD7 GJB6"
20,177,0.2126,3312,7821,0.2883,0.999999,"CDCA7L INMT CARD11 MTURN CHN2 FAM126A TRA2A EPDR1 GGCT HOXA13 IGFBP3 RAPGEF5 HOXA5 PURB ABCA13 ABCB5 ADCY1 AEBP1 AP5Z1 AVL9 C7orf57 C7orf72 CRHR2 DBNL DFNA5 FAM188B FIGNL1 FKBP9 GCK GLI3 H2AFV IGFBP1 INHBA KIAA0895 LRRC72 MMD2 MYL7 MYO1G NPC1L1 NUPR1L PDE1C PHKG1 PKD1L1 POM121L12 PRR15 PSPH RAMP3 RNASET2 SCIN SEPT14 SUMF2 TNS3 UBE2D4 UPP1 URGCP VOPP1 VSTM2A VWC2 WIPF3 ZNF713 ZPBP GRID2IP HOXA9 RNF216 DPY19L1 HOXA1 ADCYAP1R1 AGR2 AGR3 AMZ1 ANKMY2 ANKRD61 BBS9 BZW2 CBX3 CYP2W1 DAGLB DGKB DNAH11 FAM221A FERD3L GHRHR GNA12 GPNMB HDAC9 HERPUD2 HOXA11 HOXA6 HOXA7 ICA1 IQCE ITGB8 MICALL2 NME8 NPSR1 NPVF NPY PRKAR1B RP9 SNX10 SOSTDC1 SP4 SP8 STK17A STK31 SUGCT TBRG4 TMED4 TMEM184A TMEM196 TOMM7 TTYH3 WIPI2 ZMIZ2 GPR141 CCDC126 HOXA10 SKAP2 HOXA2 CPVL LANCL2 COA1 FKBP14 EEPD1 PGAM2 KLHL7 HOXA3 NEUROD6 ZNF716 GBAS EVX1 OSBPL3 ZNRF2 TMEM106B NOD1 OCM RSPH10B2 ZDHHC4 MPP6 MPLKIP KDELR2 AIMP2 FBXL18 FAM220A HIBADH DDC STEAP1B BLVRA KBTBD2 GPER1 TBX20 HECW1 POLM PPP1R17 AGMO BMPER C7orf31 CAMK2B ELMO1 GRB10 IGF2BP3 POU6F2 SFRP4 C7orf25 NT5C3A ZNF12 AMPH CCM2 NACAD RADIL RSPH10B SLC29A4 AHR RBAK PHF14 CCZ1B SNX8"
21,7,0.8636,18.14,92.35,0.1457,0.951651,"SCD SREBF1 ACSL3 C12orf49 MBTPS1 SCAP CYB5B"
22,84,0.1860,648.4,5022,0.1111,1.00000,"HNRNPR MTFR1L NCMAP ECE1 TMEM57 AGTRAP HTR6 KDF1 NECAP2 PADI3 SFN WDTC1 ZNF436 C1orf127 ESPN LZIC MYOM3 FBXO6 OTUD3 PLA2G2F CLCNKB LUZP1 NIPAL3 WNT4 AGMAT NR0B2 PADI1 FCN3 ARHGEF19 FAM76A C1QB TMEM82 PAQR7 SH3BGRL3 UBXN10 ALDH4A1 PADI4 GPR3 NBL1 TCEA3 CLIC4 MUL1 ZNF683 C1orf234 HTR1D FAM229A PRAMEF7 LDLRAD2 TMCO4 CATSPER4 FBLIM1 CLCNKA TRIM63 NPPA SLC9A1 TAS1R2 HSPB7 MASP2 SLC25A34 CD164L2 IL22RA1 IFNLR1 SPATA21 FAM131C ATPIF1 TRNP1 FUCA1 RSG1 MAN1C1 EPHB2 TNFRSF1B PINK1 EXTL1 LIN28A PNRC2 SLC30A2 PTAFR TMEM39B CD52 CELA3A AUNIP RCC2 IGSF21 RPS6KA1"
23,149,0.3251,3584,6759,0.3368,0.332042,"HKR1 C19orf47 GMFG TIMM50 CNTD2 ATP1A3 LRFN3 TTC9B DPY19L3 DLL3 SELV HPN CD22 CLIP3 ZNF569 ZNF382 SCGB2B2 ZNF30 FXYD5 MAP4K1 PAPL RGS9BP LGALS13 ANKRD27 CATSPERG NUDT19 FFAR1 FCGBP U2AF1L4 CLC SLC7A9 FXYD7 HSPB6 ZNF585B CAPNS1 FXYD3 PRODH2 ZNF420 FXYD1 PLEKHG2 ZFP36 ZFP14 ZNF790 MAP3K10 FAM187B DYRK1B PRX LSR SDHAF1 APLP1 YIF1B CEP89 PPP1R14A SPRED3 ZNF567 SYNE4 CHST8 PLD3 NCCRP1 WDR88 IFNL2 RINL NPHS1 ZNF461 PEPD ZNF527 VSTM2B ZNF568 ZNF540 TDRD12 ZFP30 HCST LRFN1 GGN ZBTB32 WDR62 MIA ZNF571 SIPA1L3 CCER2 CEBPG ZNF345 LGALS14 LGI4 SIRT2 TYROBP UPK1A ZNF302 GAPDHS LRP3 FAM98C C19orf33 FBXO27 SBSN C19orf12 EID2B GRAMD1A ZNF507 RYR1 IFNL3 ZNF546 WDR87 ZNF607 ZNF536 ETV2 CCNE1 LGALS4 TMEM147 ZNF780B ZNF570 FFAR3 MAG ZNF573 DPF1 KRTDAP ALKBH6 ARHGAP33 FFAR2 IGFLR1 KMT2B NFKBID PLEKHF1 THAP8 ZNF599 IFNL1 RASGRP4 EID2 KCNK6 SLC7A10 KIRREL2 TSHZ3 ZNF829 SERTAD1 ZNF181 ZFP82 LIN37 ZNF793 KCTD15 ZNF383 C19orf40 COX6B1 DMKN LGALS7B SCN1B USF2 ZNF566 ZNF792 ATP4A LSM14A"
24,7,0.9904,20.80,107.9,0.1457,0.999299,"UBE2H YPEL5 GID8 RANBP9 RMND5A WDR26 MAEA"
25,112,0.3454,2147,4729,0.3024,0.977532,"CASQ2 CD58 NTNG1 AP4B1 KCNA10 GSTM3 TRIM45 AMPD2 PALMD C1orf162 KCNA3 RSBN1 SYT6 ZNF697 AKNAD1 CELSR2 CHIA EPS8L3 FAM19A3 FRRS1 MOV10 PSRC1 RWDD3 SLC6A17 ST7L PPM1J SORT1 VAV3 GSTM4 LRIG2 TSHB WNT2B RHOC BCL2L15 AGL ATXN7L2 CSF1 NRBF2 GNAT2 TMEM167B WDR47 FAM46C PTPN22 GNAI3 MAGI3 DENND2C MYBPHL OLFML3 FNDC7 TBX15 VCAM1 C1orf194 HIPK1 MAB21L3 HENMT1 KCNC4 HMGCS2 TSPAN2 SIKE1 LRIF1 SNX7 AMPD1 SPAG17 GSTM2 CAPZA1 GPR61 CYB561D1 PHTF1 SYPL2 PIFO CD101 DRAM2 ADAM30 C1orf137 GPSM2 GSTM5 HAO2 HSD3B1 HSD3B2 NGF REG4 SLC22A15 SLC25A24 UBL4B VTCN1 CHI3L2 OVGP1 DBT CDC14A ADORA3 RAP1A CD2 DENND2D AMIGO1 AMY1A AMY2B CD53 EXTL2 KCND3 PROK1 SLC16A4 VANGL1 FAM212B LRRC39 PNRC2 KCNA2 PHGDH ALX3 AMY2A NBPF6 SYCP1 PTGFRN"
26,24,0.3620,99.92,687.0,0.1197,1.00000,"KARS GINS3 AARS CENPT CIAPIN1 CIRH1A GINS2 NIP7 NUDT21 POLR2C SF3B3 SLC7A6OS TANGO6 TERF2 ORC6 CDT1 CFDP1 ZC3H18 NUP93 VPS4B EXOSC6 BANP DHX38 ATP6V0D1"
27,165,0.2469,3340,6227,0.3375,0.465974,"TM9SF4 TTLL9 DDX27 ADNP COMMD7 PLTP ADA LBP C20orf173 SEMG2 AAR2 ASIP BPIFB6 CCM2L CPNE1 DLGAP4 DNMT3B DUSP15 FAM83C FOXS1 HCK ITCH KCNS1 MYH7B MYLK2 NNAT PHF20 PI3 PLCG1 RBPJL SAMHD1 SLC13A3 SOGA1 TP53INP2 XKR7 ZNF341 GTSF1L ZNFX1 RIMS4 PTGIS BPIFA2 OCSTAMP DEFB116 NCOA6 ERGIC3 SPATA25 GDAP1L1 WFDC3 C20orf144 TOMM34 PLAGL2 PXMP4 SLC12A5 PABPC1L CBFA2T2 CHD6 SLC35C2 ZSWIM1 CDK5RAP1 NECAB3 TGM2 ADIG BLCAP MMP9 ASXL1 DEFB124 WFDC6 CEP250 BPI HM13 ACTL10 WFDC8 RNF114 BPIFB3 BPIFB4 JPH2 EPPIN FAM65C PIGT R3HDML SDC4 SERINC3 SUN5 WISP2 NDRG3 KIF3B SPATA2 SLC2A10 MAP1LC3A SPAG4 BPIFB1 OSER1 POFUT1 WFDC2 WFDC5 TNNC2 BPIFA1 BPIFB2 GHRH SNTA1 VSTM2L WFDC9 IFT52 BPIFA3 CDH22 CNBD2 DEFB118 EPB41L1 GGT7 ID1 KIAA1755 MAFB MAPRE1 MYL9 PCIF1 PKIG PPP1R16B RALY SCAND1 SLA2 SLC32A1 SLPI SPINT3 SPINT4 TLDC2 TOX2 WFDC10A WFDC10B WFDC11 YWHAB ZHX3 ZSWIM3 PREX1 COX4I2 ZFP64 PROCR WFDC13 DEFB115 C20orf24 EDEM2 KCNK15 BCAS4 CEBPB KCNB1 SNAI1 TGIF2 RBL1 NOL4L TP53TG5 CD40 E2F1 CTSA GDF5 DEFB121 SGK2 MMP24 REM1 WFDC12 SRSF6 PIGU STK4 DEFB119 SRC TRPC4AP DEFB123"
28,46,0.3449,356.9,1879,0.1533,1.00000,"EPHA6 MINA CD47 CLDND1 MYH15 SENP7 OR5K3 TAGLN3 TBC1D23 NIT2 OR5K4 SLC35A5 ARL6 ARL13B DZIP3 IMPG2 NXPE3 ZPLD1 DCBLD2 CD200R1 GPR15 IFT57 RETNLB ST3GAL6 OR5H14 OR5K1 OR5H15 COL8A1 PROS1 OR5H2 TMEM45A ALCAM PCNP OR5H6 OR5AC2 FILIP1L BTLA CDV3 CPOX OR5H1 GPR128 STX19 BBX NSUN3 LNP1 CEP97"
29,147,0.1716,1841,7025,0.2010,1.00000,"A1BG C19orf18 CDC42EP5 CGB2 COX6B2 DHDH DNAAF3 FPR3 HSD17B14 ISOC2 SHISA7 SIGLEC10 SLC27A5 SMIM17 SYNGR4 TSKS VSIG10L ZBTB45 ZNF132 ZNF135 ZNF175 ZNF256 ZNF324 ZNF324B ZNF350 ZNF418 ZNF460 ZNF497 ZNF550 ZNF615 ZNF667 ZNF749 ZNF805 ZNF880 ZSCAN18 ZSCAN5A LENG9 ZNF649 ZNF154 AURKC PPP6R1 PRKCG ERVV-2 ZNF543 ZNF701 LILRA4 FCAR RDH13 KIR2DL3 ZNF432 SIGLEC12 LAIR2 ZNF865 ZNF71 NLRP12 ZNF524 ZNF579 SSC5D ZNF610 ZNF773 FUZ LILRA2 EPN1 NLRP4 GPR32 FPR1 TARM1 LILRA1 SPIB LILRB2 LAIR1 MYBPC2 PPP1R12C TMEM238 ZNF784 ZNF534 IL11 LIM2 LILRA5 NLRP2 HSPBP1 PEG3 NLRP5 KLK12 EMC10 FAM71E1 KLK6 NLRP9 ZNF587 VN1R4 ZNF548 ZNF28 ZNF766 KLK2 ZNF552 SIGLEC9 ZNF616 ZNF835 DPRX ZNF665 ZNF814 ZNF530 PTPRH SIGLEC8 ZNF528 NLRP7 NLRP11 TMEM150B NAPSA ASPDH KIR2DL4 SIGLECL1 ZFP28 ZNF211 VSTM1 LILRB5 SIGLEC5 ZNF581 ZNF264 ZNF320 KLK3 ZNF606 RFPL4A TNNI3 NLRP13 ZNF416 ZNF816 LILRB4 BRSK1 KIR3DL1 ZNF415 ZSCAN1 ZIM3 ZNF417 ZNF787 ZNF160 ZNF813 ZNF304 ZNF772 KLK11 ZNF765 ZNF584 ZNF329 ZSCAN5B VN1R1 KIR2DL1 GP6"
30,176,0.1677,2583,7173,0.2555,1.00000,"S100A8 RIIAD1 CLK2 ETV3L RXFP4 DCST2 CGN SLAMF6 C2CD4D HCN3 SLAMF1 LRRC71 CCDC19 OR6N2 LIX1L LYSMD1 MTMR11 S100A16 THEM5 ITLN1 BGLAP C1orf61 GPATCH4 OR10R2 OR6K6 IL6R TMOD4 LRRC52 AIM2 CTSK PRUNE S100A10 SELENBP1 PEX11B XCL1 FCRL4 APOA1BP SLC27A3 FCGR3A MPZ SELP UBQLN4 HIST2H2AB AQP10 FMO2 PIAS3 CD1D KRTCAP2 DENND4B APOA2 CD5L FCRL3 S100A9 SH2D1B THBS3 TRIM46 OR10J5 S100A12 KCNJ10 ACP6 ANKRD35 ANP32E ANXA9 APCS BNIPL CD1C CDC42SE1 CIART CRNN DCST1 FAM63A FLG2 FMO5 GJA5 GOLPH3L HFE2 HIST2H2BE HIST2H4B LCE6A MLLT11 OTUD7B PRKAB2 RFX5 S100A2 S100A4 SHE SV2A TDRKH TNFAIP8L2 ZNF687 NES PGLYRP3 ITLN2 VANGL2 SEMA4A MTX1 RUSC1 C1orf43 C1orf192 OR10X1 USF1 MUC1 SPRR2E PKLR ADAM15 ADAMTS4 B4GALT3 CA14 EFNA4 FAM72B FCGR2A HAPLN2 RRNAD1 SCAMP3 TSACC TSTD1 TTC24 ADAMTSL4 DPT ARHGAP30 RXRG DEDD FCGR2B INSRR NR1I3 NTRK1 PVRL4 SLC50A1 C1orf54 ECM1 GABPB2 OAZ3 PAQR6 PBXIP1 PEAR1 RORC S100A1 S100A6 SLC25A44 TMEM79 YY1AP1 ATP8B2 ETV3 SLAMF7 MNDA CD1B HSPA6 GBA FAM189B HDGF CD244 CELF3 CADM3 OR10K1 C1orf56 ATP1A2 SCNM1 USP21 MEX3A NPR1 IGSF9 FCRLA SLAMF8 PRR9 RAB25 CD1E FCER1G OR10T2 UBE2Q1 FCRL5 RIT1 SYT11 ARHGEF11 LCE3E FCRL1 PYGO2"
31,86,0.2003,732.2,5349,0.1171,1.00000,"PPIB SH2D7 FAM219B CIB2 IGDCC3 VIMP RCCD1 ITGA11 CHRNB4 UACA ISLR CT62 THAP10 DAPK2 MYZAP KIF7 PARP6 PLIN1 DIS3L THSD4 ISG20 ARPIN HAPLN3 C15orf27 NEIL1 HDDC3 CYP11A1 ANKRD34C CPEB1 TMED3 TTC23 PML AP3S2 CSNK1G1 KLHL25 HOMER2 CYP1A2 ANPEP SEMA7A HCN4 LMAN1L MAN2C1 STOML1 CSPG4 MEGF11 CD276 PDE8A ANKDD1A BBS4 RASL12 ETFA LOXL1 PLEKHO2 SH3GL3 SNX22 CELF6 FES CORO2B CTSH ADAMTS7 C15orf39 C15orf59 CALML4 CYP1A1 FBXO22 GOLGA6B GOLGA6L10 PEX11A SCAMP2 SKOR1 FSD2 LINGO1 STRA6 GRAMD2 FBXL22 GDPGP1 SLC24A1 HDGFRP3 CRABP1 ARNT2 REC114 AP3B2 NR2F2 HYKK GOLGA6D SENP8"
32,17,0.5526,75.15,376.2,0.1548,0.999996,"AAAS CDCA3 KPNA2 NDC1 NUP153 NUP188 NUP35 NUP37 NUP43 NUP50 POM121C TARDBP POM121 TMEM201 AHCTF1 NUP133 NUP160"
33,9,0.4479,16.12,112.2,0.1102,0.999853,"DYRK1A CDK6 CCND1 CDK4 AMBRA1 CCND3 CDKN2C RB1 CCND2"
34,161,0.1971,2539,6406,0.2739,1.00000,"SERPINE1 RSBN1L CCDC132 NAT16 PLOD3 ACTL6B POM121C ORAI2 CLDN3 PON1 TRIP6 FGL2 TRIM74 TYW1 CLIP2 GNAT3 DLX6 ZKSCAN1 AZGP1 C7orf63 CYP3A43 CYP51A1 FAM185A FBXO24 GNAI1 KCTD7 LAMB1 PCOLCE SAMD9 TBL2 ZNF804B STX1A CCDC146 CD36 CLDN15 MBLAC1 MUC12 SRI ADAM22 PCLO GJC3 SSC4D CUX1 ARPC1B POM121 MOSPD3 ZSCAN25 ABHD11 AP1S1 ASL BAZ1B CLDN4 CYP3A5 FKBP6 FZD9 GAL3ST4 GATAD1 GATS GSAP GTF2IRD2 GUSB HIP1 MLXIPL NCF1 NSUN5 PHTF2 SEMA3E SLC12A9 TRIM50 TSC22D4 UPK3B WBSCR16 WBSCR17 ZP3 LAT2 C7orf61 SAMD9L SMURF1 PMS2 GTF2IRD1 CACNA2D1 FBXL13 IMMP2L VKORC1L1 AGFG2 DNAJC30 GRM3 VPS37D AP4M1 BAIAP2L1 C7orf43 CDHR3 FAM200A IFT22 MOGAT3 PON3 SAP25 CALN1 NYAP1 ANKIB1 FZD1 KPNA7 LRRC17 ZNF394 ZNF679 TMEM243 LRWD1 STEAP2 ALKBH4 CNPY4 CYP3A7 GIGYF1 OCM2 PON2 PVRIG SLC26A5 TECPR1 THAP5 TMEM248 WBSCR28 ZNF789 ELN TPST1 RABGEF1 CCL24 BHLHA15 SPDYE2 TMEM130 UFSP1 ZSCAN21 RELN ERV3-1 GPC2 SPDYE1 OR2AE1 RASA4 UPK3BL ZCWPW1 HEPACAM2 LRCH4 EPO PILRA PILRB VGF ZKSCAN5 ZNF655 POR GATSL2 RASA4B ARMC10 ZNF3 ZNF92 ZNF736 TRIM73 EIF4H MAGI2 CCL26 ZNF273 ZNF479 ZNF727P ZNF138"
35,45,0.2159,213.8,1583,0.1133,1.00000,"GPRIN1 GFPT2 OR2V2 SQSTM1 BOD1 RGS14 B4GALT7 BTNL8 CBY3 DOK3 GRM6 RASGEF1C UNC5A NSD1 UIMC1 ZNF879 EIF4E1B CLK4 PRR7 FLT4 ZNF346 C5orf45 HMP19 PHYKPL TRIM52 MXD3 LTC4S FAM153B C5orf47 SLC34A1 RUFY1 RNF44 MGAT4B SFXN1 RAB24 TRIM41 CREBRF CLTB NKX2-5 CANX DRD1 TSPAN17 ZNF454 FGFR4 CNOT6"
36,95,0.1980,884.1,4626,0.1551,1.00000,"SGCA ARL17A HOXB5 BCAS3 HOXB7 ACE C17orf58 CSHL1 EFCAB3 MBTD1 PLEKHM1 PNPO STRADA SAMD14 WFIKKN2 DLX3 ADAM11 CALCOCO2 CUEDC1 OSBPL7 XYLT2 ACSF2 CCDC182 MRC2 MYCBPAP SKAP1 CSH2 PCTP PDK2 RNFT1 RPS6KB1 TBX2 KIF2B LIMD2 PRR29 SLC16A6 TEX2 YPEL2 EPX ABCC3 B4GALNT2 GDPD1 LPO LRRC46 NGFR PRR15L SCPEP1 STH MPO SPATA20 SP6 TBX21 HOXB1 NXPH3 HOXB6 MYL4 CHAD HOXB9 SNX11 CACNA1G C17orf67 CYB561 FMNL1 MAP3K3 MKS1 MTMR4 NME1 OR4D1 PRAC1 RSAD1 C17orf82 ICAM2 KCNH6 MAPT OR4D2 SEPT4 SPAG9 ANKFN1 ANKRD40 CA10 HSF5 RNF43 SCRN2 ZNF652 TEX14 TBKBP1 PPM1E ATP5G1 FAM117A BZRAP1 NME2 SMG8 DGKE IGF2BP1 COIL"
37,75,0.2209,612.9,3158,0.1563,1.00000,"HHIPL1 TECPR2 CRIP1 ASPG SERPINA11 CCDC88C C14orf79 CRIP2 GOLGA5 TSHR ATXN3 INF2 AMN APOPT1 EVL FBLN5 KIF26A TDP1 UNC79 BDKRB1 BTBD6 TEX22 TC2N C14orf177 SERPINA3 ADSSL1 RPS6KA5 TCL1A ZC3H14 CEP170B BAG5 SETD3 EXOC3L4 BEGAIN CYP46A1 IFI27 EML5 RD3L TDRD9 PPP1R13B SERPINA4 ZBTB42 MOK SLC24A4 SPATA7 KLC1 C14orf159 MTA1 ANKRD9 BCL11B SERPINA1 SERPINA12 FAM181A PRIMA1 C14orf142 PPP4R4 TTC7B SLC25A29 AKT1 CDC42BPB EML1 JAG2 NUDT14 PACS2 PLD4 RIN3 TMEM121 SLC25A47 DIO3 AK7 UBR7 GPR68 DLK1 CDCA4 SMEK1"
38,170,0.2125,3052,6697,0.3025,0.993750,"STC1 LEPROTL1 KIAA1456 PRSS55 PIWIL2 LONRF1 MSR1 SFTPC NAT1 ANK1 HTRA4 SLC18A1 PHYHIP DEFB136 CTSB KIF13B ERLIN2 RNF5 RNF122 XPO7 TACC1 DMTN ADAM2 ADAM32 KCNU1 BNIP3L IDO1 PNMA2 SORBS3 DDHD2 POMK PPAPDC1B FUT10 KBTBD11 SCARA5 EGR3 ADRB3 DEFB1 SGCZ SMIM18 DEFB104A RNF170 DEFA4 FGF17 USP17L2 ENTPD4 MTUS1 NKX3-1 PLAT POLB BMP1 CHRNA2 PTK2B SCARA3 FBXO16 C8orf4 EBF2 FZD3 SARAF AP3M2 PPP3CC ZNF596 ARHGEF10 DOK2 BIN3 STMN4 DEFA5 EPHX2 SLC20A2 FAM167A NEIL2 MTMR7 GOT1L1 SH2D4A ADAM9 TNFRSF10A DEFB134 LETM2 FAM160B2 NPM2 PNOC SLC7A2 MYOM2 CHRNA6 ADAM18 CCDC25 FGF20 GFRA2 PEBP4 PROSC SFRP1 STAR VDAC3 ZMAT4 DEFB103B ADAM28 CHRNB3 DKK4 DUSP26 EIF4EBP1 EXTL3 FGFR1 GPR124 HGSNAT HMBOX1 HOOK3 IKBKB LSM1 NKX6-3 PURG SMIM19 TEX15 TNFRSF10D FAM90A1 ADAM7 ADAMDEC1 ADRA1A C8orf58 CCAR2 CDCA2 CSGALNACT1 DEFB105A DEFB106A DEFB4A DPYSL2 LOXL2 MSRA NRG1 PBK PDGFRL PDLIM2 PRR23D2 PSD3 RBPMS RHOBTB2 SGK223 SPAG11B TNFRSF10B TNFRSF10C ZDHHC2 BLK ZNF395 CLU ERI1 FGL1 LZTS1 NUGGC C8orf48 HR NAT2 SLC39A14 GATA4 LGI3 SLC35G5 GSR C8orf74 KAT6A CLDN23 DEFA1 DEFB4B DEFB107B SOX7 PPP1R3B TM2D2 ASAH1 XKR6 ZNF705B KCTD9 DEFB135 DEFB108B"
